2020年4月9日	アリババ、大規模なオンライン・コミュニケーションをサポートするDingTalk Liteを発表	https://www.alibaba.co.jp/news/2020/04/dingtalk-lite.html	日本やマレーシア、シンガポール、香港、マカオ向けに開発されたLite版アプリアリババグループは4月9日、新型コロナウイルス感染症(COVID-19)の世界的な拡大に伴って影響を受けている地域の企業や教育機関を支援するために、同社が提供するコミュニケーション・プラットフォーム「DingTalk(ディントーク、中国語:釘釘、以下DingTalk)」のライト版アプリ「DingTalk Lite(ディントーク・ライト)」を発表しました。DingTalk Lite は App Store や Google Play ストアなどの複数のアプリストアから無料でダウンロードできます。DingTalk Liteでは、300人以上が同時に参加できるビデオ会議機能や、最大1,000人が参加できる高精細ライブ配信機能、写真や映像の共有機能、ベーシックな1対1のチャット機能などを提供します。現在、日本語、英語、中国語(繁体字)に対応しており、日本、マレーシア、シンガポール、香港、マカオのユーザー向けに提供されています。DingTalkの最高技術責任者(CTO)のヒューゴ・ジュ(Hugo Zhu、朱 鴻)は、次のように述べています。「新型コロナウイルス感染症の世界的な拡大により、リモートワークや遠隔授業に対する需要が高まる中、当社は最先端技術を活用して、企業や学校が、可能な限り運営を維持できるようサポートしたいと考えています。 現在アジア地域において、さまざまなレベルの行動制限と自己隔離を実施する都市が増えていることから、ビジネスにおけるビデオ会議やオンライン授業のライブ配信に対する需要がこれまで以上に高まっています。今回発表したDingTalk Liteを通じて、より多くのユーザーのオンライン・コミュニケーションをサポートしてまいりたいと存じます。」DingTalk Liteの主な機能には、以下が含まれます。ライブ配信:1,000人の参加者を1つのライブ配信グループに招待し、同時にその配信を複数のグループで共有して実施することで、視聴者数を最大化ことができます。ビデオ会議:地域に関係なく最大302人が参加できるビデオ会議の開催が可能で、画面共有やドライブ上でのファイル共有もできます。また、美顔効果機能である「ビューティー・モード」や録画機能も搭載されています。グループチャット機能:最大1,000人までが参加可能で、全員または特定の参加者に通知を送信できます。中国語や日本語、英語を含む14カ国語での双方向翻訳を可能にするAI翻訳機能により、言語の壁を超えて自由にコミュニケーションをとることができます。連絡先やチーム管理:企業や組織、チームの作成など、連絡先の容易な管理が可能です。また、DingTalk(Lite版を含む)では、日本のユーザー向けのDingTalkを利用したリモートワークに関するQA集「DingTalkリモートワークガイド」や、教育機関の円滑なオンライン授業の準備・実施をサポートする マニュアルを公開しています。アリババグループのデータ・インテリジェンス・バックボーンであるアリババクラウドの安全で耐障害性の高いグローバル・インフラを活用する、DingTalk(Lite版を含む)は、ここ数ヶ月で通信需要が急増する中でも、低遅延で高精細なビデオ会議とライブ配信を提供してきました。中国では約1,000万社の企業がDingTalkをリモートワークに利用しており、また新型コロナウイルス感染症の拡大時には中国全土で1億2,000万人以上の学生がDingTalkを利用してオンライン授業を受講しました。DingTalkは、ライブ・ストリーミングおよびグループチャット機能を提供するほか、世界中の医療専門家が新型コロナウイルス感染症対策に関する情報や経験を共有し合いながら、円滑なコミュニケーションを図れるように設計された「国際医療専門家コミュニケーション・プラットフォーム」を通じて、サポートしています。DingTalkはまた、新型コロナウイルス感染症が世界的に拡大する中、遠隔授業を促進するソリューションのひとつとして、ユネスコ(UNESCO、国際連合教育科学文化機関)より推薦されています。参考情報・DingTalkリモートワークワークガイド・DingTalk遠隔オンライン授業ワンストップソリューションDingTalkについてDingTalk(ディントーク、中国語:「釘釘」)は、アリババグループが中小企業を支援するために自社開発した一体型コミュニケーションおよびモバイルオフィスサービスです。クラウドテクノロジーをベースとしたDingTalkは、2015年よりサービス開始し、業務効率化に役立つツールとして1,000万を超える企業、2億人以上のユーザーに信頼される企業プラットフォームに成長しました。DingTalkは、インスタントメッセージ、音声通話、ビデオ会議、ワークフロー管理など、さまざまな機能を提供し、安全・安心なコミュニケーションおよび効率的な働き方の実現を目指しています。アリババクラウドについて2009年に設立されたアリババクラウドは (www.alibabacloud.com)、アリババグループのデータ・インテリジェンス・バックボーンです。調査会社ガートナー社によると、アリババクラウドは世界のIaaSプロバイダーの上位3社に入ります。また、調査会社IDCによると、アリババクラウドは中国におけるパブリック・クラウドサービスの最大手プロバイダーでもあり、同社のマーケットプレイスを利用する事業者、スタートアップ、企業、公共サービスを含む、世界中の組織に包括的なクラウド・コンピューティング・サービスを提供しています。アリババクラウドは、国際オリンピック委員会 (IOC) の公式クラウドサービス・パートナーでもあります。本件に関する報道関係者からのお問い合わせ先アリババクラウド広報担当:カレント・グローバル 
2020年4月17日	天猫国際、今後1年間で1,000ブランドの中国進出を支援すると発表	https://www.alibaba.co.jp/news/2020/04/11000.html	アリババグループのBtoC越境ECプラットフォーム「天猫国際(Tmall Global)」は4月16日、天猫国際マーチャントカンファレンスにて、今後1年間で1,000の海外ブランドの中国進出を支援し、天猫国際プラットフォームへの新規加入を促進すると発表しました。天猫輸出入事業部 ジェネラルマネージャー アルビン・リュウ(劉鵬:Alvin Liu)のコメント「世界的な新型コロナウイルス感染症の流行により、輸入市場は短期的には変動していますが、長期的には好転していくでしょう。今年も非常に多くの新カテゴリーと新商品が天猫国際で発表されており、海外ブランドは中国市場で新たな消費トレンドと成長機会を掴むことが重要です。我々はマーチャントのコストを削減し、海外ブランドがより気軽に、より速いペースで中国市場に参入できるようにサポートする必要があります。」大手グローバル会計事務所のデロイト中国が今年2月に発表した「デロイト新視点(Deloitte Perspective)」の輸入消費編によると、中国の越境EC(電子商取引)による輸入商品取引の普及率は、2014年の約2%から2018年には約14%に上昇しています。3級～5級都市の人々の収入が年々増加していること、インターネットの普及により新興地域での消費が成熟していること、小売のデジタル化により国境を越えたECがより広範囲の地域で可能になっていることを踏まえ、デロイトは中国での輸入品の消費がより普及していくと予測しています。このような状況を踏まえ、天猫国際は今後、海外ブランドの中国市場への参入を加速させ、中国消費者により多種多様な輸入商品を提供するため、新規マーチャントの申請プロセスを簡素化し、出店承認の効率化を図ります。また、専任チームを設置し、中英バイリンガルで対応可能な1対1の開店サポートサービスを提供します。同時に、一回の申請で出店手続きが完了するセルフ出店サービスも導入し、「わずか30日間で出店へ」という目標の達成も目指します。さらに、天猫国際は海外ブランドの中国市場への進出を加速させるため、今年3月に「マーチャントインキュベーションセンター」を設立しました。同センターは一連のマーケティング施策の提供によって、海外ブランドが中国市場により素早く進出し、中国消費者にアプローチできるように支援します。天猫国際に新規出店するブランドが90日以内に売上高100万元(1,500万円*)を達成できるよう支援することを目標にしています。また、同センターでは、毎月21日に売れ行きが好調な海外ブランドを集めて実施するライブコマースイベントや、「輸入の日」などの販促イベントを通じて、マーチャントのマーケティング活動を支援しています。海外ブランドの開店スピードは前年同期比300%加速ANAホールディングスも今年3月に出店天猫国際にはこれまでに世界92の国と地域から2万5,000以上の海外ブランドが出店しており、そのうち80%以上が中国市場へ初進出しています。商品カテゴリーは5,100以上に達しています。このように海外ブランドの中国市場進出を支援してきた天猫国際は、海外ブランドが新型コロナウイルス感染症(COVID-19)の世界的な流行の影響を乗り越えられるように、海外マーチャントのプラットフォーム使用料の軽減、総額5億元(75億円*)の低金利ローンの提供、物流コストの削減、アリペイを通じた自動決算申請基準の緩和による海外マーチャントのキャッシュフローの円滑化などの支援策を今年2月から展開しています。参考:アリババとアント フィナンシャル、20項目のマーチャント支援策を発表、新型コロナの影響克服を目指す天猫国際のデータによると、今年の1月から3月までの期間に20万以上の新商品が天猫国際のプラットフォームで発売されました。また、海外ブランドの開店申請から店舗開設までのスピードは、前年同期(2019年1月-3月)を300%も上回るペースとなっています。日本の航空会社であるANAホールディングスも3月上旬に天猫国際へ出店しました。この一連の新型コロナウイルス感染症の流行に対抗する支援施策は、2018年末にアリババグループが設定した2,000億ドルのグローバル輸入計画を前進させるものでもあります。2018年11月、アリババグループは第1回中国国際輸入博覧会(China International Import Expo、以下「CIIE」)にて、今後5年間で120以上の国と地域から2,000億ドルの商品を輸入する目標を発表しました。発表から1年後の2019年11月には、アリババグループ会長兼CEOのダニエル・チャンが第2回CIIEにて、アリババグループが初年度の目標の123%を達成したことを発表しています。参考:天猫国際、中国への海外商品輸入拡大を推進する新たな支援ソリューションを発表天猫国際は2019年12月、中国市場への海外ブランドの新規参入を促進し、より多くの海外ブランドの中国における成長を支援するために、組織を拡充し、5大陸20カ国以上のマーチャントに対応できるようにしました。さらにマーチャント向けのWEBサイト(https://merchant.tmall.hk/)を英語、フランス語、ドイツ語、日本語、韓国語、イタリア語、スペイン語の7言語に対応させました。また、海外マーチャントにフィットしたより良いサービスの提供を目指して、サプライチェーンやエコシステムをさらに改善していきます。*1元=15円で計算天猫国際(Tmall Global)とは天猫国際(www.tmall.hk)は、アリババグループのショッピンプラットフォームの一つです。中国消費者の間で高まる海外商品への需要に応えるために、2014年に開設されました。中国国外のブランドや小売業者に、中国に拠点を設けずに、中国消費者に直接商品を提供し、ブランドを構築していただけるプラットフォームとなっています。
2020年4月28日	アリババクラウドが3年連続で、IaaSプロバイダーとして世界で3位、APAC市場シェアでは1位に、米ガートナー調べ	https://www.alibaba.co.jp/news/2020/04/3iaas3apac1.html	4月28 日、アリババグループのデータ・インテリジェンスの中枢であるアリババクラウドは、米調査会社ガートナーが公開した最新レポート「Market Share: IT Services, Worldwide 2019」において、Infrastructure as a Service(IaaS)分野のプロバイダーとして世界で3位に選出されました。また、アジア太平洋地域では、IaaSプロバイダーとして市場シェア1位を連続3年で記録しています。ガートナーのレポートによると、アリババクラウドの2019年のグローバル市場シェアは9.1%で、2018年の7.7%から1.4ポイント上昇しており、また2019年のアジア太平洋地域での市場シェアは28.2%で2018年の26.1%から2.1ポイント上昇したことが明らかになりました。アリババクラウドは21の地域に63のアベイラビリティゾーンを展開し、世界で数百万を超えるお客様に安定したサービスを提供しています。またアリババクラウドは事業を展開する国と地域で適用される法律や規制を遵守しており、現在世界で70以上のセキュリティとコンプライアンスの認定を受けています。ガートナーの調査結果に加えて、米調査会社IDCが発表したレポート「世界パブリック・クラウドサービス市場の動向調査(Worldwide Semiannual Public Cloud Services Tracker)」では、2019年上半期にアリババクラウドはグローバルな大手クラウド・サービス・プロバイダーの中で最も急速に成長していることが示されています。参考資料:・ガートナ―のレポートは以下のURLよりダウンロードいただけます。(ガートナー有料サブスクライバ資格が必要となります)     https://www.gartner.com/en/documents/3983385/market-share-it-services-worldwide-2019・アリババクラウドジャパンのホームページ:https://www.alibabacloud.com/ja
