2022年4月4日	メルカリ、ウクライナからの避難民受け入れ団体に向けた「やさしい日本語」コミュニケーションセミナーを無償提供	https://about.mercari.com//press/news/articles/20220404_ukraine/	〜ウクライナ人道危機に対する「メルカリ寄付」機能の支援先に「国境なき医師団」も追加決定〜株式会社メルカリ(以下、メルカリ)は、ウクライナからの避難民の受け入れ団体(自治体・学校・雇用受け入れを予定している事業者等)に向けたサポートプログラムとして、メルカリが独自開発した「やさしい日本語」コミュニケーションセミナーを無償提供いたします。本セミナーの提供に先駆け、本日より自治体・学校・雇用受け入れを予定している事業者等を対象に申し込み受付を開始いたします。また、「メルカリ寄付」機能におけるウクライナ人道危機に対する支援先に「緊急チーム募金(国境なき医師団)」を今月から追加することが決定いたしましたので、併せてお知らせいたします。メルカリは、「新たな価値を生みだす世界的なマーケットプレイスを創る」というミッションを掲げており、こうした世界的な危機的状況の中で私たちにできることは何かを今後も考え続け、取り組んでまいります※1。※1:今回のロシアによるウクライナ侵攻に対する当社としてのステートメントはこちらをご覧ください。https://about.mercari.com/press/news/articles/20220310_ukraine/「やさしい日本語」についてメルカリの東京オフィスでは約40カ国以上の国籍のメンバーが勤務しており、業務上のコミュニケーションは主に日本語と英語が使用されています。そのため、メルカリでは日本語または英語を学習する社員に向けて、日本語・英語トレーナーが社員として在籍するLanguage Education Team(LET)を通じ、「言語学習プログラム」を提供しているほか、「やさしいコミュニケーション」という研修プログラムを独自開発し、提供しています。本プログラムは日本語話者、英語話者がそれぞれ「日本語学習者にとって難しい日本語」「英語学習者にとって難しい英語」について学び、相手に合わせて「やさしい日本語」や「やさしい英語」でコミュニケーションができるようになることを目標にしたトレーニングです。たとえば、尊敬語や謙譲語、擬音語や擬態語を多用する日本語は、日本語を母語としない方(以下、日本語非母語話者)にとって非常に複雑で理解がしにくいと言われています。日本で快適に生活を送るためには日本語非母語話者が日本語を学ぶことも必要ですが、日本語を母語とする方(以下、日本語母語話者)も「やさしい日本語」を学び意識することで、相互理解がしやすくなる効果があります。日本語非母語話者に寄り添ったコミュニケーションの重要性が、近年指摘されています※2,3。今回のロシアによるウクライナへの侵攻により、ウクライナから日本に避難された人々を人道的見地から支援するため、自治体・学校・事業者等による受け入れが進んでおりますが、受け入れ先においては、この先長期に渡って避難民の方々と接する機会があります。このような受け入れ先の方に向けて、メルカリがこれまでに社内トレーニングを通じて培ってきたノウハウを提供することで、日本語母語話者、日本語非母語話者の歩み寄りのコミュニケーションへの貢献を目指します※4。※2:やさしい日本語の普及による情報提供等の促進に関する検討会議「報告書 やさしい日本語の普及による情報提供等の促進の在り方」(令和4年3月)、出入国在留管理庁ホームページ より※3:一般社団法人 日本経済団体連合会「Innovating Migration Policies―2030年に向けた外国人政策のあり方」(2022年2月15日)※4:本コミュニケーションセミナーは、ウクライナからの避難民受け入れ団体を対象とするものであり、避難民の方に直接実施するものではありません。「やさしい日本語」コミュニケーションセミナー概要・申し込み方法【セミナー概要】募集期間:2022年4月4日(月)〜6月30日(木)実施形式:オフラインまたはオンライン(申し込みいただいた団体とご相談の上、決定します)セミナー時間:90分プログラム概要:・やさしい日本語の基本・やさしい日本語による「歩み寄りコミュニケーション」の考え方・やさしい日本語への言い換え練習費用:無償【申し込み方法】「やさしい日本語」コミュニケーションセミナーの提供を希望される団体の方は、以下のフォームより申し込みをお願いいたします。https://about.mercari.com/contact/easy-japanese/【備考】本セミナーの対象は自治体・学校・雇用受け入れを予定している事業者等、ウクライナからの避難民の受け入れ団体とさせていただきます。また、ご応募を多数いただいた場合には、ご提供がかなわない可能性もございますので、予めご了承ください。ウクライナ人道危機に対する「メルカリ寄付」機能の支援先に「緊急チーム募金(国境なき医師団)」も追加また、「メルカリ寄付」機能※5におけるウクライナ人道危機に対する支援先に「緊急チーム募金(国境なき医師団)」を今月から追加※6することが決定いたしました。この寄付先を通じ、ウクライナ緊急援助などの活動支援を行ってまいります。なお、3月10日より開始していた「ウクライナ危機緊急子ども支援(セーブ・ザ・チルドレン)」への寄付は目標額に到達いたしましたので、3月31日をもって終了いたしました。ご協力いただいたみなさまに感謝いたします。なお、「ウクライナ緊急募金(日本ユニセフ協会)」への寄付は継続して実施しております。※5:「メルカリ寄付」についてはこちらをご覧くださいhttps://about.mercari.com/press/news/articles/20200827_mercari_kifu/※6:メルカリ、ウクライナ人道危機に対する支援を 「メルカリ寄付」機能で受付開始〜ユニセフ、セーブ・ザ・チルドレンと連携して支援〜https://about.mercari.com/press/news/articles/20220310_mercari_kifu/連携団体国境なき医師団https://www.msf.or.jp/支援概要
2022年4月6日	メルカリ、AI関連の取り組みをまとめたWebサイト「mercari AI Web」を公開	https://about.mercari.com//press/news/articles/20220406_mercariaiweb/	株式会社メルカリ(以下、メルカリ)は本日、当社のAI関連の取り組みをまとめたWebサイト「mercari AI Web」( https://ai.mercari.com/ 以下、AI Web)を公開しましたので、お知らせいたします。メルカリでは、2013年のサービス提供開始以来、急速なプロダクト開発によって、お客さまにより使いやすいUI/UXを提供することに注力してきました。2017年以降は、社内にAIを専門としたチームを組成し、UI/UX改善のみならず、メルカリをより安心・安全に使える機能や仕組みを提供してまいりました。メルカリは世界中の個人と個人をつなぎ、誰もが簡単にモノの売り買いを楽しめるサービスを提供するため、メルカリに蓄積された膨大なデータのさらなる利活用を進めています。データ・AIを利用し、お客さま一人ひとりにパーソナライズされたサービス開発を行うことで、さまざまな「売り買い」の体験をよりスムーズに、より高速に、そしてより安全なサービスを提供することを目指します。Webサイト新設の目的・背景メルカリのAIに関する取り組みやメンバーの情報を、AI Webに集約することで、メルカリにおけるAI戦略・今後のAI活用に関するビジョンを継続的に発信することを目的としています。また今後、フリマアプリ「メルカリ」を運営するメルカリのみならず、グループ会社のメルペイ、メルカリUS、ソウゾウでのAI活用に関しても、AI Webを通じて情報発信を行ってまいります。Webサイト概要名称:mercari AI WebURL:https://ai.mercari.com/公開日:2022年4月6日掲載中のコンテンツ:プロダクトに活用されているAI技術の紹介「AI出品」パーソナライゼーションあんしん・あんぜんのための自動違反検知機械学習によるカスタマーサポートの生産性向上 等論文ページ社内メンバーによって執筆された論文一覧の紹介メンバーページメルカリのAIチーム紹介対談『山田進太郎・Director 木村俊也が振り返る、メルカリのAI活用の歩み』メルカリは今後もAI技術の開発・研究を進め、限られた資源が循環し、誰もが新たな価値を生みだせる社会の実現に貢献してまいります。
2022年4月8日	鹿嶋市・メルカリ・鹿島アントラーズの地方創生事業、鹿嶋市内にアディッシュプラス株式会社の事業所を誘致	https://about.mercari.com//press/news/articles/20220407_adishplus/	鹿嶋市(市長:錦織孝一)と株式会社メルカリ(本社:東京都港区、代表取締役社長 CEO:山田進太郎、以下「メルカリ」)、株式会社鹿島アントラーズ・エフ・シー(本社:茨城県鹿嶋市、代表取締役社長:小泉文明、以下「鹿島アントラーズ」)は3者合同の地方創生事業として、デジタルエコノミー特化のカスタマーサクセスソリューション・プロバイダーであるアディッシュプラス株式会社(本社:沖縄県那覇市 代表取締役:石川琢磨、以下「アディッシュプラス」)の事業所「鹿嶋BASE」を鹿嶋市に誘致し、2022年6月1日より鹿島アントラーズのカスタマーサクセス業務を委託することになりましたので、お知らせいたします。今回の企業誘致は、2020年2月に鹿嶋市、メルカリ、鹿島アントラーズ・エフ・シーが地域課題の解決を目的として締結した「鹿嶋市における地方創生事業に関する包括連携協定」に基づく取り組みとなります。鹿嶋市内にアディッシュプラスの事業所を構え、今後は他の事業者からも業務を受託するなど事業拡大していくことで新たな雇用の機会を創出し、事業所周辺の交流人口の増加や地域の活性化を図ります。本事業の背景・目的メルカリグループでは、ESGの重点課題(マテリアリティ)の一つに「地域活性化」を掲げており、地方自治体との連携などを通じて地域経済の活性化や地域の方々が自ら課題を解決できる仕組みの構築を支援しています。このたび、メルカリを通じて鹿島アントラーズがホームタウンである鹿嶋市にアディッシュプラスを紹介し、企業誘致が実現しました。鹿島アントラーズは、テクノロジーを活用したカスタマーサクセス事業体制を有するアディッシュプラスとともにビジネスを推進し、工場を有しない同社のようなインターネット企業を誘致することで、地域における新たな雇用機会創出と活性化につなげていきます。また、持続可能な地域社会の実現に向け、地域行政やテクノロジー企業のハブとなり、さらなる企業誘致を支援・推進していきます。アディッシュプラス株式会社概要設立:2012年6月29日代表者名:石川琢磨事業内容:24時間365日対応のソーシャルメディアに関するモニタリング&マーケティング、スクールガーディアン(こどものネットいじめ対策、ICT教育支援)、MaaS・ソーシャルアプリ・EC等のカスタマーサポート代行(電話・メール・チャットなど)、WEBサービスの企画・構築・運用・保守コメント<鹿嶋市市長 錦織孝一>「地方創生に係る包括連携協定の取組が企業誘致という成果に結びつき、大変うれしく思います。また、IT関連企業の更なる誘致など市の賑わい創出について、協定3社に加え、アディッシュプラス㈱とも協力しながら進められることを期待しています。」<アディッシュプラス株式会社 代表取締役 石川 琢磨>「アディッシュプラスの活動拠点を鹿嶋市に設立できることになり、大変嬉しく思います。鹿島アントラーズ様のカスタマーサクセス支援を通じて、地域貢献につながる活動を積極的に展開していきたいと考えております。」<株式会社メルカリ取締役会長 兼 株式会社鹿島アントラーズ・エフ・シー代表取締役社長 小泉文明>「鹿嶋市、メルカリ、鹿島アントラーズの包括連携協定の一環としてアディッシュプラス様の事業所の誘致が実現したことを大変嬉しく思います。メルカリはESGの重点課題に地域活性化を掲げており、グループが持つテクノロジーやアセットを最大限に活用しながら、地域密着の鹿島アントラーズとともに、雇用の創出など、地域の発展に貢献してまいります。」
2022年4月18日	メルカリ、「東京レインボープライド2022」に協賛・ ブース出展	https://about.mercari.com//press/news/articles/20220418_tokyorainbowpride2022/	株式会社メルカリ(以下、メルカリ)は、特定非営利活動法人東京レインボープライド(以下、東京レインボープライド)が主催する、アジア最大級のLGBTQ関連イベント「東京レインボープライド2022」に協賛し、 4月22日(金)〜4月24日(日)に代々木公園で開催される「プライドフェスティバル」にブースを出展いたしますので、お知らせします。メルカリは「新たな価値を生みだす世界的なマーケットプレイスを創る」というミッションを掲げ、個々の多様な経験や視点を尊重したチームづくりを目指し、D&Iの推進をしています。以来、LGBTQとそのアライ(多様な性のあり方に理解のある、非当事者の支援者)によるコミュニティ「Pride@Mercari」を設立するなど、社内外で様々な活動を実施してまいりました。この度、東京レインボープライドが目指す「LGBTQをはじめとするセクシュアル・ マイノリティ(性的少数者)が、差別や偏見にさらされることなく、より自分らしく、前向きに生きていくことができる社会の実現」に賛同し、「東京レインボープライド2022」への協賛およびブース出展が決定いたしました。「プライドフェスティバル」出展ブースについてメルカリは「東京レインボープライド2022」の期間、代々木公園で開催される「プライドフェスティバル」に、メルカリが目指す「インクルーシブ」な世界をテーマにブースを出展します。当日は「Pride@Mercari」での活動をはじめとした、メルカリがこれまで取り組んできたD&I推進施策の紹介のほか、LGBTQとそのアライの方々により使いやすいサービスの提供を目指し、来場者の声を集める催しなどを企画しています。ぜひ大切な人と一緒にブースへお越しください。日程: 4月22日(金)13:00〜18:00/4月23日(土)･24日(日)11:00〜18:00場所: 東京都渋谷区代々木公園イベント広場メルカリは今後も、様々な取り組みを通じて、多様な人材が活躍できる環境の実現を目指してまいります。
